{
  "schedule_version": "0.1",
  "title": "合成项目进度示例 · 非真实项目",
  "as_of": "2027-01-06",
  "calendar": "calendar_days",
  "refs": [
    {
      "id": "synthetic-schedule",
      "revision": 1,
      "locator": "本文件：显式合成日期与状态"
    }
  ],
  "baseline": {
    "id": "B1",
    "revision": 1,
    "approved_on": "2026-12-10",
    "refs": [
      {
        "id": "synthetic-schedule",
        "revision": 1,
        "locator": "baseline"
      }
    ]
  },
  "tasks": [
    {
      "id": "requirements",
      "label": "范围与接口确认",
      "owner": "产品",
      "state": "done",
      "refs": [
        {
          "id": "synthetic-schedule",
          "revision": 1,
          "locator": "tasks.requirements"
        }
      ],
      "baseline": {
        "start": "2026-12-10",
        "finish": "2026-12-14"
      },
      "actual": {
        "start": "2026-12-10",
        "finish": "2026-12-15"
      },
      "progress": {
        "value": 100,
        "basis": "五项检查项均已确认",
        "refs": [
          {
            "id": "synthetic-schedule",
            "revision": 1,
            "locator": "checks"
          }
        ]
      },
      "acceptance": {
        "status": "accepted",
        "criteria": "范围及五项接口检查完成",
        "result": "五项检查已确认",
        "scope": "范围与接口文档，不代表项目整体验收",
        "refs": [
          {
            "id": "synthetic-schedule",
            "revision": 1,
            "locator": "acceptance.requirements"
          }
        ]
      }
    },
    {
      "id": "integration",
      "label": "系统联调",
      "owner": "交付",
      "state": "blocked",
      "refs": [
        {
          "id": "synthetic-schedule",
          "revision": 1,
          "locator": "tasks.integration"
        }
      ],
      "baseline": {
        "start": "2026-12-16",
        "finish": "2026-12-28"
      },
      "actual": {
        "start": "2026-12-16"
      },
      "forecast": {
        "finish": "2027-01-12"
      },
      "progress": {
        "value": 60,
        "basis": "12/20项约定用例通过；不是时间经过比例",
        "refs": [
          {
            "id": "synthetic-schedule",
            "revision": 1,
            "locator": "cases"
          }
        ]
      },
      "condition": "预测仍依赖外部接口环境及支持人落实",
      "acceptance": {
        "status": "pending",
        "criteria": "约定联调用例通过",
        "result": "12项通过，8项待处理",
        "scope": "联调范围",
        "refs": [
          {
            "id": "synthetic-schedule",
            "revision": 1,
            "locator": "acceptance.integration"
          }
        ]
      }
    },
    {
      "id": "business",
      "label": "业务验收",
      "owner": "业务",
      "state": "not_started",
      "refs": [
        {
          "id": "synthetic-schedule",
          "revision": 1,
          "locator": "tasks.business"
        }
      ],
      "baseline": {
        "start": "2026-12-29",
        "finish": "2027-01-08"
      },
      "forecast": {
        "start": "2027-01-13",
        "finish": "2027-01-19"
      },
      "condition": "验收窗口仍需业务确认",
      "acceptance": {
        "status": "not_submitted",
        "criteria": "核心业务流程按标准验证",
        "scope": "业务交付范围"
      }
    }
  ],
  "milestones": [
    {
      "id": "launch",
      "label": "试点上线",
      "baseline_date": "2027-01-17",
      "forecast_date": "2027-01-22",
      "condition": "需先完成联调与业务验收",
      "refs": [
        {
          "id": "synthetic-schedule",
          "revision": 1,
          "locator": "milestones.launch"
        }
      ]
    }
  ],
  "dependencies": [
    {
      "from": "requirements",
      "to": "integration",
      "type": "FS",
      "lag": 0,
      "refs": [
        {
          "id": "synthetic-schedule",
          "revision": 1
        }
      ]
    },
    {
      "from": "integration",
      "to": "business",
      "type": "FS",
      "lag": 0,
      "refs": [
        {
          "id": "synthetic-schedule",
          "revision": 1
        }
      ]
    }
  ],
  "snapshots": [
    {
      "reported_on": "2026-12-16",
      "baseline_ref": {
        "id": "B1",
        "revision": 1
      },
      "forecasts": [
        {
          "milestone_id": "launch",
          "date": "2027-01-17",
          "refs": [
            {
              "id": "synthetic-schedule",
              "revision": 1,
              "locator": "snapshot.1007"
            }
          ]
        }
      ]
    },
    {
      "reported_on": "2026-12-22",
      "baseline_ref": {
        "id": "B1",
        "revision": 1
      },
      "forecasts": [
        {
          "milestone_id": "launch",
          "date": "2027-01-18",
          "refs": [
            {
              "id": "synthetic-schedule",
              "revision": 1,
              "locator": "snapshot.1014"
            }
          ]
        }
      ]
    },
    {
      "reported_on": "2026-12-30",
      "baseline_ref": {
        "id": "B1",
        "revision": 1
      },
      "forecasts": [
        {
          "milestone_id": "launch",
          "date": "2027-01-20",
          "refs": [
            {
              "id": "synthetic-schedule",
              "revision": 1,
              "locator": "snapshot.1021"
            }
          ]
        }
      ]
    },
    {
      "reported_on": "2027-01-06",
      "baseline_ref": {
        "id": "B1",
        "revision": 1
      },
      "forecasts": [
        {
          "milestone_id": "launch",
          "date": "2027-01-22",
          "refs": [
            {
              "id": "synthetic-schedule",
              "revision": 1,
              "locator": "snapshot.1028"
            }
          ]
        }
      ]
    }
  ],
  "summary": {
    "task_ids": [
      "requirements",
      "integration",
      "business"
    ],
    "milestone_ids": [
      "launch"
    ],
    "reason": "覆盖当前三个工作包及试点节点，保留受阻事项与验收条件"
  },
  "actions": [
    {
      "id": "support",
      "text": "确认接口环境及支持人",
      "owner": "协调负责人",
      "due": "2027-01-08",
      "refs": [
        {
          "id": "synthetic-schedule",
          "revision": 1,
          "locator": "actions.support"
        }
      ]
    },
    {
      "id": "window",
      "text": "确认业务验收窗口",
      "owner": "业务负责人",
      "due": "2027-01-11",
      "refs": [
        {
          "id": "synthetic-schedule",
          "revision": 1,
          "locator": "actions.window"
        }
      ]
    }
  ],
  "limits": [
    "全部日期、状态和结果为合成输入；不对应MASTer实际指标。"
  ]
}
