{
  "schedule_version": "0.1",
  "title": "合成项目进度示例 · 非真实项目",
  "as_of": "2026-10-28",
  "calendar": "calendar_days",
  "refs": [
    {
      "id": "synthetic-schedule",
      "revision": 1,
      "locator": "本文件：显式合成日期与状态"
    }
  ],
  "tasks": [
    {
      "id": "requirements",
      "label": "范围与接口确认",
      "owner": "产品",
      "state": "done",
      "refs": [
        {
          "id": "synthetic-schedule",
          "revision": 1,
          "locator": "tasks.requirements"
        }
      ],
      "actual": {
        "start": "2026-10-01",
        "finish": "2026-10-06"
      },
      "progress": {
        "value": 100,
        "basis": "五项检查项均已确认",
        "refs": [
          {
            "id": "synthetic-schedule",
            "revision": 1,
            "locator": "checks"
          }
        ]
      }
    },
    {
      "id": "integration",
      "label": "系统联调",
      "owner": "交付",
      "state": "blocked",
      "refs": [
        {
          "id": "synthetic-schedule",
          "revision": 1,
          "locator": "tasks.integration"
        }
      ],
      "actual": {
        "start": "2026-10-07"
      },
      "forecast": {
        "finish": "2026-11-03"
      },
      "progress": {
        "value": 60,
        "basis": "12/20项约定用例通过；不是时间经过比例",
        "refs": [
          {
            "id": "synthetic-schedule",
            "revision": 1,
            "locator": "cases"
          }
        ]
      },
      "condition": "预测仍依赖外部接口环境及支持人落实",
      "acceptance": {
        "status": "rejected",
        "criteria": "约定联调用例通过",
        "result": "12项通过，8项待处理",
        "scope": "联调范围",
        "refs": [
          {
            "id": "synthetic-schedule",
            "revision": 1,
            "locator": "acceptance.integration"
          }
        ]
      }
    },
    {
      "id": "business",
      "label": "业务验收",
      "owner": "业务",
      "state": "not_started",
      "refs": [
        {
          "id": "synthetic-schedule",
          "revision": 1,
          "locator": "tasks.business"
        }
      ],
      "forecast": {
        "start": "2026-11-04",
        "finish": "2026-11-10"
      },
      "condition": "验收窗口仍需业务确认",
      "acceptance": {
        "status": "not_submitted",
        "criteria": "核心业务流程按标准验证",
        "scope": "业务交付范围"
      }
    }
  ],
  "milestones": [
    {
      "id": "launch",
      "label": "试点上线",
      "forecast_date": "2026-11-13",
      "condition": "需先完成联调与业务验收",
      "refs": [
        {
          "id": "synthetic-schedule",
          "revision": 1,
          "locator": "milestones.launch"
        }
      ]
    }
  ],
  "dependencies": [
    {
      "from": "requirements",
      "to": "integration",
      "type": "FS",
      "lag": 0,
      "refs": [
        {
          "id": "synthetic-schedule",
          "revision": 1
        }
      ]
    },
    {
      "from": "integration",
      "to": "business",
      "type": "FS",
      "lag": 0,
      "refs": [
        {
          "id": "synthetic-schedule",
          "revision": 1
        }
      ]
    }
  ],
  "summary": {
    "task_ids": [
      "requirements",
      "integration",
      "business"
    ],
    "milestone_ids": [
      "launch"
    ],
    "reason": "覆盖当前三个工作包及试点节点，保留受阻事项与验收条件"
  },
  "actions": [
    {
      "id": "support",
      "text": "确认接口环境及支持人",
      "owner": "协调负责人",
      "due": "2026-10-30",
      "refs": [
        {
          "id": "synthetic-schedule",
          "revision": 1,
          "locator": "actions.support"
        }
      ]
    },
    {
      "id": "window",
      "text": "确认业务验收窗口",
      "owner": "业务负责人",
      "due": "2026-11-02",
      "refs": [
        {
          "id": "synthetic-schedule",
          "revision": 1,
          "locator": "actions.window"
        }
      ]
    }
  ],
  "limits": [
    "全部日期、状态和结果为合成输入；不对应MASTer实际指标。"
  ]
}
